Sheet: PARQUE CENTRAL MAIA
A1: TN | B1: CPE | C1: Local | D1: FATURA | E1: IN√çCIO PER√çODO | F1: FIM PER√çODO | G1: DIAS | H1: FATURA TOTAL ‚Ç¨ | I1: FATURA S/IVA NORMAL | J1: PHP [Kw] | K1: PHP ‚Ç¨ | L1: PC [Kw] | M1: PC/T.POT ‚Ç¨ | N1: Ponta [kWh] | O1: Ponta Ene. [‚Ç¨/kWh] | P1: Ponta Tar.[‚Ç¨/kWh] | Q1: Cheia [kWh] | R1: Cheia Ene. ‚Ç¨/kWh | S1: Cheia Tar. ‚Ç¨/kWh | T1: Vazio [kWh] | U1: Vazio Ene. ‚Ç¨/kWh | V1: Vazio Tar. ‚Ç¨/kWh | W1: SVazio [kWh] | X1: SVazio Ene. ‚Ç¨/kWh | Y1: SVazio Tar. ‚Ç¨/kWh | Z1: TOT ATIVA [KWh] | AA1: TOT ATIVA ‚Ç¨ | AB1: Total RI [KVARH] | AC1: RI ‚Ç¨ | AD1: RI Faturada 3 [KVARH] | AE1: RI Faturada 3 ‚Ç¨ | AF1: RI Faturada 2 [KVARH] | AG1: RI Faturada 2 ‚Ç¨ | AH1: RI Faturada 1 [KVARH] | AI1: RI Faturada 1 ‚Ç¨ | AJ1: RC [KVARH] | AK1: RC ‚Ç¨
A2: MT | B2: PT0002000081997398TD | C2: PARQUE CENTRAL MAIA | D2: 11170000037811 | E2: 2016-12-23T00:00:00.000 | F2: 2017-01-22T00:00:00.000 | G2: =RC[-1]-RC[-2] -> 30 | H2: 5195.93 | I2: 4224.7300000000005 | J2: 108.69 | K2: 426.43 | L2: 232.5 | M2: 270.03000000000003 | N2: 5706.05 | Q2: 16511.87 | T2: 10590.25 | W2: 4321.8500000000004 | Z2: =SUM(RC[-12]+RC[-9]+RC[-6]+RC[-3]) -> 37130.019999999997 | AA2: 2021.24 | AB2: =SUM(RC[2],RC[4],RC[6]) -> 3191.67 | AC2: =SUM(RC[2],RC[4],RC[6]) -> 207.46 | AD2: 2206.23 | AE2: 189.45 | AF2: 453.95 | AG2: 12.99 | AH2: 531.49 | AI2: 5.0200000000000005 | AJ2: 542.78 | AK2: 0.24
A3: MT | B3: PT0002000081997398TD | C3: PARQUE CENTRAL MAIA | D3: 11170000128897 | E3: 2017-01-23T00:00:00.000 | F3: 2017-02-22T00:00:00.000 | G3: =RC[-1]-RC[-2] -> 30 | H3: 4915.3 | I3: 3996.57 | J3: 54.41 | K3: 445.48 | L3: 232.5 | M3: 286.14 | N3: 6257.49 | Q3: 16673.7 | T3: 8725.06 | W3: 4338.87 | Z3: =SUM(RC[-12]+RC[-9]+RC[-6]+RC[-3]) -> 35995.120000000003 | AA3: 1982.7399999999998 | AB3: =SUM(RC[2],RC[4],RC[6]) -> 0 | AC3: =SUM(RC[2],RC[4],RC[6]) -> 0 | AD3: 0 | AE3: 0 | AF3: 0 | AG3: 0 | AH3: 0 | AI3: 0 | AJ3: 497.88 | AK3: 0.22
A4: MT | B4: PT0002000081997398TD | C4: PARQUE CENTRAL MAIA | D4: 11170000194246 | E4: 2017-02-23T00:00:00.000 | F4: 2017-03-22T00:00:00.000 | G4: =RC[-1]-RC[-2] -> 27 | H4: 4245.59 | I4: 3452.09 | J4: 52.55 | K4: 388.61 | L4: 232.5 | M4: 258.45 | N4: 5255.19 | Q4: 14046.01 | T4: 7911.11 | W4: 3920.32 | Z4: =SUM(RC[-12]+RC[-9]+RC[-6]+RC[-3]) -> 31132.63 | AA4: 1706.15 | AB4: =SUM(RC[2],RC[4],RC[6]) -> 0 | AC4: =SUM(RC[2],RC[4],RC[6]) -> 0 | AD4: 0 | AE4: 0 | AF4: 0 | AG4: 0 | AH4: 0 | AI4: 0 | AJ4: 504.58 | AK4: 0.38
A5: MT | B5: PT0002000081997398TD | C5: PARQUE CENTRAL MAIA | D5: 11170000262288 | E5: 2017-03-23T00:00:00.000 | F5: 2017-04-22T00:00:00.000 | G5: =RC[-1]-RC[-2] -> 30 | H5: 4581.7300000000005 | I5: 3725.38 | J5: 55.55 | K5: 454.77 | L5: 232.5 | M5: 286.14 | N5: 3721.67 | Q5: 16332.53 | T5: 9444.2100000000009 | W5: 4176.7 | Z5: =SUM(RC[-12]+RC[-9]+RC[-6]+RC[-3]) -> 33675.11 | AA5: 1827.56 | AB5: =SUM(RC[2],RC[4],RC[6]) -> 0 | AC5: =SUM(RC[2],RC[4],RC[6]) -> 0 | AD5: 0 | AE5: 0 | AF5: 0 | AG5: 0 | AH5: 0 | AI5: 0 | AJ5: 619.95000000000005 | AK5: 0.22
A6: MT | B6: PT0002000081997398TD | C6: PARQUE CENTRAL MAIA | D6: 11170000327405 | E6: 2017-04-23T00:00:00.000 | F6: 2017-05-22T00:00:00.000 | G6: =RC[-1]-RC[-2] -> 29 | H6: 4392.8500000000004 | I6: 3571.82 | J6: 55.9 | K6: 442.89 | L6: 232.5 | M6: 276.91000000000003 | N6: 3186.24 | Q6: 14932.32 | T6: 10545.29 | W6: 4095.24 | Z6: =SUM(RC[-12]+RC[-9]+RC[-6]+RC[-3]) -> 32759.089999999997 | AA6: 1755.2299999999998 | AB6: =SUM(RC[2],RC[4],RC[6]) -> 0 | AC6: =SUM(RC[2],RC[4],RC[6]) -> 0 | AD6: 0 | AE6: 0 | AF6: 0 | AG6: 0 | AH6: 0 | AI6: 0 | AJ6: 913.83 | AK6: 0.66
A7: MT | B7: PT0002000081997398TD | C7: PARQUE CENTRAL MAIA | D7: 11170000392292 | E7: 2017-05-23T00:00:00.000 | F7: 2017-06-22T00:00:00.000 | G7: =RC[-1]-RC[-2] -> 30 | H7: 5315.6 | I7: 4322.0200000000004 | J7: 61.32 | K7: 502 | L7: 232.5 | M7: 286.14 | N7: 4046.83 | Q7: 19393.38 | T7: 11523.69 | W7: 5133.4800000000005 | Z7: =SUM(RC[-12]+RC[-9]+RC[-6]+RC[-3]) -> 40097.380000000005 | AA7: 2168.17 | AB7: =SUM(RC[2],RC[4],RC[6]) -> 0 | AC7: =SUM(RC[2],RC[4],RC[6]) -> 0 | AD7: 0 | AE7: 0 | AF7: 0 | AG7: 0 | AH7: 0 | AI7: 0 | AJ7: 2153.25 | AK7: 1.37
A8: MT | B8: PT0002000081997398TD | C8: PARQUE CENTRAL MAIA | D8: 11170000445922 | E8: 2017-06-23T00:00:00.000 | F8: 2017-07-22T00:00:00.000 | G8: =RC[-1]-RC[-2] -> 29 | H8: 6032.59 | I8: 4904.9400000000005 | J8: 65.989999999999995 | K8: 522.87 | L8: 232.5 | M8: 276.91000000000003 | N8: 4157.62 | Q8: 23147.96 | T8: 13814.32 | W8: 5489.38 | Z8: =SUM(RC[-12]+RC[-9]+RC[-6]+RC[-3]) -> 46609.279999999992 | AA8: 2520.09 | AB8: =SUM(RC[2],RC[4],RC[6]) -> 0 | AC8: =SUM(RC[2],RC[4],RC[6]) -> 0 | AD8: 0 | AE8: 0 | AF8: 0 | AG8: 0 | AH8: 0 | AI8: 0 | AJ8: 1939.03 | AK8: 1.68
A9: MT | B9: PT0002000081997398TD | C9: PARQUE CENTRAL MAIA | D9: 11170000513591 | E9: 2017-07-23T00:00:00.000 | F9: 2017-08-22T00:00:00.000 | G9: =RC[-1]-RC[-2] -> 30 | H9: 5018.26 | I9: 4080.28 | J9: 59.94 | K9: 490.75 | L9: 232.5 | M9: 286.14 | N9: 3776.32 | Q9: 18014.57 | T9: 10905.18 | W9: 4633.07 | Z9: =SUM(RC[-12]+RC[-9]+RC[-6]+RC[-3]) -> 37329.14 | AA9: 2018.15 | AB9: =SUM(RC[2],RC[4],RC[6]) -> 0 | AC9: =SUM(RC[2],RC[4],RC[6]) -> 0 | AD9: 0 | AE9: 0 | AF9: 0 | AG9: 0 | AH9: 0 | AI9: 0 | AJ9: 3131.53 | AK9: 15.31
A10: MT | B10: PT0002000081997398TD | C10: PARQUE CENTRAL MAIA | D10: 11170000573968 | E10: 2017-08-23T00:00:00.000 | F10: 2017-09-22T00:00:00.000 | G10: =RC[-1]-RC[-2] -> 30 | H10: 4705.43 | I10: 3825.95 | J10: 54.35 | K10: 444.94 | L10: 232.5 | M10: 286.14 | N10: 3749.89 | Q10: 17888.060000000001 | T10: 8457.84 | W10: 4341.8599999999997 | Z10: =SUM(RC[-12]+RC[-9]+RC[-6]+RC[-3]) -> 34437.65 | AA10: 1886.13 | AB10: =SUM(RC[2],RC[4],RC[6]) -> 0 | AC10: =SUM(RC[2],RC[4],RC[6]) -> 0 | AD10: 0 | AE10: 0 | AF10: 0 | AG10: 0 | AH10: 0 | AI10: 0 | AJ10: 1690.05 | AK10: 8.02
A11: MT | B11: PT0002000081997398TD | C11: PARQUE CENTRAL MAIA | D11: 11170000632715 | E11: 2017-09-23T00:00:00.000 | F11: 2017-10-22T00:00:00.000 | G11: =RC[-1]-RC[-2] -> 29 | H11: 4163.6400000000003 | I11: 3385.47 | J11: 51.28 | K11: 406.3 | L11: 232.5 | M11: 276.91000000000003 | N11: 2923.03 | Q11: 14410.93 | T11: 9655.9 | W11: 3929.13 | Z11: =SUM(RC[-12]+RC[-9]+RC[-6]+RC[-3]) -> 30918.99 | AA11: 1659.95 | AB11: =SUM(RC[2],RC[4],RC[6]) -> 0 | AC11: =SUM(RC[2],RC[4],RC[6]) -> 0 | AD11: 0 | AE11: 0 | AF11: 0 | AG11: 0 | AH11: 0 | AI11: 0 | AJ11: 527.08000000000004 | AK11: 0.06
A12: MT | B12: PT0002000081997398TD | C12: PARQUE CENTRAL MAIA | D12: 11170000690057 | E12: 2017-10-23T00:00:00.000 | F12: 2017-11-22T00:00:00.000 | G12: =RC[-1]-RC[-2] -> 30 | H12: 4321.7700000000004 | I12: 3514.03 | J12: 50.06 | K12: 409.85 | L12: 232.5 | M12: 286.14 | N12: 5006 | Q12: 14345.98 | T12: 8190.16 | W12: 3785.43 | Z12: =SUM(RC[-12]+RC[-9]+RC[-6]+RC[-3]) -> 31327.57 | AA12: 1715.1200000000001 | AB12: =SUM(RC[2],RC[4],RC[6]) -> 0 | AC12: =SUM(RC[2],RC[4],RC[6]) -> 0 | AD12: 0 | AE12: 0 | AF12: 0 | AG12: 0 | AH12: 0 | AI12: 0 | AJ12: 573.9 | AK12: 0.44
A13: MT | B13: PT0002000081997398TD | C13: PARQUE CENTRAL MAIA | D13: 11170000744626 | E13: 2017-11-23T00:00:00.000 | F13: 2017-12-22T00:00:00.000 | G13: =RC[-1]-RC[-2] -> 29 | H13: 4148.83 | I13: 3373.43 | J13: 50.44 | K13: 399.64 | L13: 232.5 | M13: 276.91000000000003 | N13: 5044.03 | Q13: 12884.08 | T13: 8672.1200000000008 | W13: 3625.9 | Z13: =SUM(RC[-12]+RC[-9]+RC[-6]+RC[-3]) -> 30226.130000000005 | AA13: 1643.96 | AB13: =SUM(RC[2],RC[4],RC[6]) -> 0 | AC13: =SUM(RC[2],RC[4],RC[6]) -> 0 | AD13: 0 | AE13: 0 | AF13: 0 | AG13: 0 | AH13: 0 | AI13: 0 | AJ13: 890.1 | AK13: 1.1300000000000001
G14: =SUM(R[-12]C:R[-1]C) -> 353 | H14: =SUM(R[-12]C:R[-1]C) -> 57037.520000000004 | I14: =SUM(R[-12]C:R[-1]C) -> 46376.71 | J14: =AVERAGE(R[-12]C:R[-1]C) -> 60.04 | K14: =SUM(R[-12]C:R[-1]C) -> 5334.5300000000007 | L14: =AVERAGE(R[-12]C:R[-1]C) -> 232.5 | M14: =SUM(R[-12]C:R[-1]C) -> 3352.96 | N14: =SUM(R[-12]C:R[-1]C) -> 52830.36 | O14: =AVERAGE(R[-12]C:R[-1]C) -> #DIV/0! | P14: =AVERAGE(R[-12]C:R[-1]C) -> #DIV/0! | Q14: =SUM(R[-12]C:R[-1]C) -> 198581.38999999998 | R14: =AVERAGE(R[-12]C:R[-1]C) -> #DIV/0! | S14: =AVERAGE(R[-12]C:R[-1]C) -> #DIV/0! | T14: =SUM(R[-12]C:R[-1]C) -> 118435.12999999998 | U14: =AVERAGE(R[-12]C:R[-1]C) -> #DIV/0! | V14: =AVERAGE(R[-12]C:R[-1]C) -> #DIV/0! | W14: =SUM(R[-12]C:R[-1]C) -> 51791.23 | X14: =AVERAGE(R[-12]C:R[-1]C) -> #DIV/0! | Y14: =AVERAGE(R[-12]C:R[-1]C) -> #DIV/0! | Z14: =SUM(R[-12]C:R[-1]C) -> 421638.11000000004 | AA14: =SUM(R[-12]C:R[-1]C) -> 22904.489999999998 | AB14: =SUM(R[-12]C:R[-1]C) -> 3191.67 | AC14: =SUM(R[-12]C:R[-1]C) -> 207.46 | AD14: =SUM(R[-12]C:R[-1]C) -> 2206.23 | AE14: =SUM(R[-12]C:R[-1]C) -> 189.45 | AF14: =SUM(R[-12]C:R[-1]C) -> 453.95 | AG14: =SUM(R[-12]C:R[-1]C) -> 12.99 | AH14: =SUM(R[-12]C:R[-1]C) -> 531.49 | AI14: =SUM(R[-12]C:R[-1]C) -> 5.0200000000000005 | AJ14: =SUM(R[-12]C:R[-1]C) -> 13983.96 | AK14: =SUM(R[-12]C:R[-1]C) -> 29.73
A15: MT | B15: PT0002000081997398TD | C15: PARQUE CENTRAL MAIA | D15: 11180000029810 | E15: 2017-12-23T00:00:00.000 | F15: 2018-01-22T00:00:00.000 | G15: =RC[-1]-RC[-2] -> 30 | H15: 4366.54 | I15: 3550.43 | J15: 106.16 | K15: 376.87 | L15: 232.5 | M15: 261.58 | N15: 5042.5200000000004 | Q15: 13477.05 | T15: 10450.530000000001 | W15: 3819.45 | Z15: =SUM(RC[-12],RC[-9],RC[-6],RC[-3]) -> 32789.549999999996 | AA15: 1768.02 | AB15: =SUM(RC[2],RC[4],RC[6]) -> 0 | AC15: =SUM(RC[2],RC[4],RC[6]) -> 0 | AD15: 0 | AE15: 0 | AF15: 0 | AG15: 0 | AH15: 0 | AI15: 0 | AJ15: 975.85 | AK15: 0.81
A16: MT | B16: PT0002000081997398TD | C16: PARQUE CENTRAL MAIA | D16: 11180000098871 | E16: 2018-01-23T00:00:00.000 | F16: 2018-02-22T00:00:00.000 | G16: =RC[-1]-RC[-2] -> 30 | H16: 4407.8500000000004 | I16: 3584.01 | J16: 49.48 | K16: 329.31 | L16: 232.5 | M16: 251.54 | N16: 5690.04 | Q16: 15095.44 | T16: 7880.39 | W16: 4092.6600000000003 | Z16: =SUM(RC[-12],RC[-9],RC[-6],RC[-3]) -> 32758.53 | AA16: 1803.05 | AB16: =SUM(RC[2],RC[4],RC[6]) -> 0 | AC16: =SUM(RC[2],RC[4],RC[6]) -> 0 | AD16: 0 | AE16: 0 | AF16: 0 | AG16: 0 | AH16: 0 | AI16: 0 | AJ16: 563.78 | AK16: 0.51
A17: MT | B17: PT0002000081997398TD | C17: PARQUE CENTRAL MAIA | D17: 11180000159075 | E17: 2018-02-23T00:00:00.000 | F17: 2018-03-22T00:00:00.000 | G17: =RC[-1]-RC[-2] -> 27 | H17: 3823.61 | I17: 3109.02 | J17: 47.69 | K17: 286.68 | L17: 232.5 | M17: 227.2 | N17: 4768.8 | Q17: 12892.08 | T17: 7128.88 | W17: 3689.13 | Z17: =SUM(RC[-12],RC[-9],RC[-6],RC[-3]) -> 28478.890000000003 | AA17: 1560.6 | AB17: =SUM(RC[2],RC[4],RC[6]) -> 0 | AC17: =SUM(RC[2],RC[4],RC[6]) -> 0 | AD17: 0 | AE17: 0 | AF17: 0 | AG17: 0 | AH17: 0 | AI17: 0 | AJ17: 589.18000000000006 | AK17: 0.6
A18: MT | B18: PT0002000081997398TD | C18: PARQUE CENTRAL MAIA | D18: 11180000217001 | E18: 2018-03-23T00:00:00.000 | F18: 2018-04-22T00:00:00.000 | G18: =RC[-1]-RC[-2] -> 30 | H18: 4641.93 | I18: 3774.32 | J18: 59.03 | K18: 392.91 | L18: 232.5 | M18: 251.54 | N18: 3660.12 | Q18: 16732.650000000001 | T18: 10491.77 | W18: 4306.83 | Z18: =SUM(RC[-12],RC[-9],RC[-6],RC[-3]) -> 35191.370000000003 | AA18: 1900.58 | AB18: =SUM(RC[2],RC[4],RC[6]) -> 0 | AC18: =SUM(RC[2],RC[4],RC[6]) -> 0 | AD18: 0 | AE18: 0 | AF18: 0 | AG18: 0 | AH18: 0 | AI18: 0 | AJ18: 1084.25 | AK18: 1.58
A19: MT | B19: PT0002000081997398TD | C19: PARQUE CENTRAL MAIA | D19: 11180000269029 | E19: 2018-04-23T00:00:00.000 | F19: 2018-05-22T00:00:00.000 | G19: =RC[-1]-RC[-2] -> 29 | H19: 4385.83 | I19: 3566.11 | J19: 55.94 | K19: 360.34 | L19: 232.5 | M19: 243.43 | N19: 3356.68 | Q19: 15860.48 | T19: 9910.36 | W19: 4235.87 | Z19: =SUM(RC[-12],RC[-9],RC[-6],RC[-3]) -> 33363.39 | AA19: 1799.6399999999999 | AB19: =SUM(RC[2],RC[4],RC[6]) -> 0 | AC19: =SUM(RC[2],RC[4],RC[6]) -> 0 | AD19: 0 | AE19: 0 | AF19: 0 | AG19: 0 | AH19: 0 | AI19: 0 | AJ19: 1259.78 | AK19: 3.64
A20: MT | B20: PT0002000081997398TD | C20: PARQUE CENTRAL MAIA | D20: 11180000317750 | E20: 2018-05-23T00:00:00.000 | F20: 2018-06-22T00:00:00.000 | G20: =RC[-1]-RC[-2] -> 30 | H20: 4520.99 | I20: 3676 | J20: 51.58 | K20: 343.3 | L20: 232.5 | M20: 251.54 | N20: 3404.32 | Q20: 17036.189999999999 | T20: 9465.35 | W20: 4472.9800000000005 | Z20: =SUM(RC[-12],RC[-9],RC[-6],RC[-3]) -> 34378.840000000004 | AA20: 1864 | AB20: =SUM(RC[2],RC[4],RC[6]) -> 6.17 | AC20: =SUM(RC[2],RC[4],RC[6]) -> 0.06 | AD20: 0 | AE20: 0 | AF20: 0 | AG20: 0 | AH20: 6.17 | AI20: 0.06 | AJ20: 2312.58 | AK20: 11.19
A21: MT | B21: PT0002000081997398TD | C21: PARQUE CENTRAL MAIA | D21: 11180000371065 | E21: 2018-06-23T00:00:00.000 | F21: 2018-07-22T00:00:00.000 | G21: =RC[-1]-RC[-2] -> 29 | H21: 5105.04 | I21: 4150.83 | J21: 57.06 | K21: 367.51 | L21: 232.5 | M21: 243.43 | N21: 3423.45 | Q21: 19488.09 | T21: 12173.14 | W21: 4714.93 | Z21: =SUM(RC[-12],RC[-9],RC[-6],RC[-3]) -> 39799.61 | AA21: 2145.3100000000004 | AB21: =SUM(RC[2],RC[4],RC[6]) -> 0 | AC21: =SUM(RC[2],RC[4],RC[6]) -> 0 | AD21: 0 | AE21: 0 | AF21: 0 | AG21: 0 | AH21: 0 | AI21: 0 | AJ21: 3339.73 | AK21: 17.02
A22: MT | B22: PT0002000081997398TD | C22: PARQUE CENTRAL MAIA | D22: 11180000422003 | E22: 2018-07-23T00:00:00.000 | F22: 2018-08-22T00:00:00.000 | G22: =RC[-1]-RC[-2] -> 30 | H22: 4675.33 | I22: 3801.48 | J22: 56.46 | K22: 375.8 | L22: 232.5 | M22: 251.54 | N22: 3726.57 | Q22: 17551.61 | T22: 9339.26 | W22: 4541.03 | Z22: =SUM(RC[-12],RC[-9],RC[-6],RC[-3]) -> 35158.47 | AA22: 1912.72 | AB22: =SUM(RC[2],RC[4],RC[6]) -> 0 | AC22: =SUM(RC[2],RC[4],RC[6]) -> 0 | AD22: 0 | AE22: 0 | AF22: 0 | AG22: 0 | AH22: 0 | AI22: 0 | AJ22: 3278.4 | AK22: 19.22
A23: MT | B23: PT0002000081997398TD | C23: PARQUE CENTRAL MAIA | D23: 11180000477919 | E23: 2018-08-23T00:00:00.000 | F23: 2018-09-22T00:00:00.000 | G23: =RC[-1]-RC[-2] -> 30 | H23: 4655.63 | I23: 3785.46 | J23: 55.8 | K23: 371.36 | L23: 232.5 | M23: 251.54 | N23: 3682.54 | Q23: 17638.37 | T23: 9044.33 | W23: 4563.05 | Z23: =SUM(RC[-12],RC[-9],RC[-6],RC[-3]) -> 34928.29 | AA23: 1902.9099999999999 | AB23: =SUM(RC[2],RC[4],RC[6]) -> 0 | AC23: =SUM(RC[2],RC[4],RC[6]) -> 0 | AD23: 0 | AE23: 0 | AF23: 0 | AG23: 0 | AH23: 0 | AI23: 0 | AJ23: 3480.4 | AK23: 22.27
A24: MT | B24: PT0002000081997398TD | C24: PARQUE CENTRAL MAIA | D24: 11180000536145 | E24: 2018-09-23T00:00:00.000 | F24: 2018-10-22T00:00:00.000 | G24: =RC[-1]-RC[-2] -> 29 | H24: 4089.04 | I24: 3324.82 | J24: 49.17 | K24: 316.72000000000003 | L24: 232.5 | M24: 243.43 | N24: 2950.35 | Q24: 14384.71 | T24: 9427.73 | W24: 4398.5200000000004 | Z24: =SUM(RC[-12],RC[-9],RC[-6],RC[-3]) -> 31161.309999999998 | AA24: 1670.55 | AB24: =SUM(RC[2],RC[4],RC[6]) -> 0 | AC24: =SUM(RC[2],RC[4],RC[6]) -> 0 | AD24: 0 | AE24: 0 | AF24: 0 | AG24: 0 | AH24: 0 | AI24: 0 | AJ24: 3448 | AK24: 20.48
A25: MT | B25: PT0002000081997398TD | C25: PARQUE CENTRAL MAIA | D25: 14180000717592 | E25: 2018-10-23T00:00:00.000 | F25: 2018-11-19T00:00:00.000 | G25: =RC[-1]-RC[-2] -> 27 | H25: 3825.56 | I25: 3110.61 | J25: 45.81 | K25: 275.36 | L25: 232.5 | M25: 227.2 | N25: 3985.04 | Q25: 12767.59 | T25: 8487.77 | W25: 3819.25 | Z25: =SUM(RC[-12],RC[-9],RC[-6],RC[-3]) -> 29059.65 | AA25: 1570.48 | AB25: =SUM(RC[2],RC[4],RC[6]) -> 0 | AC25: =SUM(RC[2],RC[4],RC[6]) -> 0 | AD25: 0 | AE25: 0 | AF25: 0 | AG25: 0 | AH25: 0 | AI25: 0 | AJ25: 2682.78 | AK25: 13.78
A26: MT | B26: PT0002000081997398TD | C26: PARQUE CENTRAL MAIA | D26: 14180000757518 | E26: 2018-11-20T00:00:00.000 | F26: 2018-12-19T00:00:00.000 | G26: =RC[-1]-RC[-2] -> 29 | H26: 4918.33 | I26: 3999.04 | J26: 57.4 | K26: 369.72 | L26: 232.5 | M26: 243.43 | N26: 6314.04 | Q26: 16293.8 | T26: 9950.48 | W26: 4595.5600000000004 | Z26: =SUM(RC[-12],RC[-9],RC[-6],RC[-3]) -> 37153.879999999997 | AA26: 2029.74 | AB26: =SUM(RC[2],RC[4],RC[6]) -> 0 | AC26: =SUM(RC[2],RC[4],RC[6]) -> 0 | AD26: 0 | AE26: 0 | AF26: 0 | AG26: 0 | AH26: 0 | AI26: 0 | AJ26: 2840.7 | AK26: 15.58
G27: =SUM(R[-12]C:R[-1]C) -> 350 | H27: =SUM(R[-12]C:R[-1]C) -> 53415.68 | I27: =SUM(R[-12]C:R[-1]C) -> 43432.130000000005 | J27: =AVERAGE(R[-12]C:R[-1]C) -> 57.631666666666653 | K27: =SUM(R[-12]C:R[-1]C) -> 4165.88 | L27: =AVERAGE(R[-12]C:R[-1]C) -> 232.5 | M27: =SUM(R[-12]C:R[-1]C) -> 2947.3999999999996 | N27: =SUM(R[-12]C:R[-1]C) -> 50004.47 | O27: =AVERAGE(R[-12]C:R[-1]C) -> #DIV/0! | P27: =AVERAGE(R[-12]C:R[-1]C) -> #DIV/0! | Q27: =SUM(R[-12]C:R[-1]C) -> 189218.05999999997 | R27: =AVERAGE(R[-12]C:R[-1]C) -> #DIV/0! | S27: =AVERAGE(R[-12]C:R[-1]C) -> #DIV/0! | T27: =SUM(R[-12]C:R[-1]C) -> 113749.99 | U27: =AVERAGE(R[-12]C:R[-1]C) -> #DIV/0! | V27: =AVERAGE(R[-12]C:R[-1]C) -> #DIV/0! | W27: =SUM(R[-12]C:R[-1]C) -> 51249.260000000009 | X27: =AVERAGE(R[-12]C:R[-1]C) -> #DIV/0! | Y27: =AVERAGE(R[-12]C:R[-1]C) -> #DIV/0! | Z27: =SUM(R[-12]C:R[-1]C) -> 404221.78 | AA27: =SUM(R[-12]C:R[-1]C) -> 21927.600000000002 | AB27: =SUM(R[-12]C:R[-1]C) -> 6.17 | AC27: =SUM(R[-12]C:R[-1]C) -> 0.06 | AD27: =SUM(R[-12]C:R[-1]C) -> 0 | AE27: =SUM(R[-12]C:R[-1]C) -> 0 | AF27: =SUM(R[-12]C:R[-1]C) -> 0 | AG27: =SUM(R[-12]C:R[-1]C) -> 0 | AH27: =SUM(R[-12]C:R[-1]C) -> 6.17 | AI27: =SUM(R[-12]C:R[-1]C) -> 0.06 | AJ27: =SUM(R[-12]C:R[-1]C) -> 25855.43 | AK27: =SUM(R[-12]C:R[-1]C) -> 126.67999999999999
A28: MT | B28: PT0002000081997398TD | C28: PARQUE CENTRAL MAIA | D28: 14190000012936 | E28: 2018-12-20T00:00:00.000 | F28: 2018-12-31T00:00:00.000 | G28: =RC[-1]-RC[-2] -> 11 | H28: 1615.8 | I28: 1313.66 | J28: 49.4 | K28: 127.27 | L28: 232.5 | M28: 97.37 | N28: 1728.88 | Q28: 4678.53 | T28: 4287.12 | W28: 1798.23 | Z28: =SUM(RC[-12],RC[-9],RC[-6],RC[-3]) -> 12492.759999999998 | AA28: 662.83 | AB28: =SUM(RC[2],RC[4],RC[6]) -> 0 | AC28: =SUM(RC[2],RC[4],RC[6]) -> 0 | AD28: 0 | AE28: 0 | AF28: 0 | AG28: 0 | AH28: 0 | AI28: 0 | AJ28: 960.88 | AK28: 2.5300000000000002
A29: MT | B29: PT0002000081997398TD | C29: PARQUE CENTRAL MAIA | D29: 14190000046407 | E29: 2019-01-01T00:00:00.000 | F29: 2019-01-19T00:00:00.000 | G29: =RC[-1]-RC[-2] -> 18 | H29: 2584.7600000000002 | I29: 2101.83 | J29: 40.99 | K29: 151.81 | L29: 232.5 | M29: 143.13 | N29: 2664.62 | Q29: 7317.53 | T29: 5083.8599999999997 | W29: 2472.58 | Z29: =SUM(RC[-12],RC[-9],RC[-6],RC[-3]) -> 17538.589999999997 | AA29: 1262.9900000000002 | AB29: =SUM(RC[2],RC[4],RC[6]) -> 7.18 | AC29: =SUM(RC[2],RC[4],RC[6]) -> 0.06 | AD29: 0 | AE29: 0 | AF29: 0 | AG29: 0 | AH29: 7.18 | AI29: 0.06 | AJ29: 528.23 | AK29: 0.97
A30: MT | B30: PT0002000081997398TD | C30: PARQUE CENTRAL MAIA | D30: 14190000145719 | E30: 2019-01-20T00:00:00.000 | F30: 2019-02-19T00:00:00.000 | G30: =RC[-1]-RC[-2] -> 30 | H30: 3923.99 | I30: 3190.63 | J30: 39.96 | K30: 241.43 | L30: 232.5 | M30: 233.52 | N30: 4395.5 | Q30: 11428.28 | T30: 6460.96 | W30: 3473.19 | Z30: =SUM(RC[-12],RC[-9],RC[-6],RC[-3]) -> 25757.93 | AA30: 1884.6200000000001 | AB30: =SUM(RC[2],RC[4],RC[6]) -> 0.5 | AC30: =SUM(RC[2],RC[4],RC[6]) -> 0 | AD30: 0 | AE30: 0 | AF30: 0 | AG30: 0 | AH30: 0.5 | AI30: 0 | AJ30: 665.08 | AK30: 1.21
A31: MT | B31: PT0002000081997398TD | C31: PARQUE CENTRAL MAIA | D31: 14190000176780 | E31: 2019-02-20T00:00:00.000 | F31: 2019-03-19T00:00:00.000 | G31: =RC[-1]-RC[-2] -> 27 | H31: 3283.54 | I31: 2669.94 | J31: 39.44 | K31: 215.24 | L31: 232.5 | M31: 210.92 | N31: 3944.15 | Q31: 9839.64 | T31: 4845.0600000000004 | W31: 2102.87 | Z31: =SUM(RC[-12],RC[-9],RC[-6],RC[-3]) -> 20731.719999999998 | AA31: 1543.76 | AB31: =SUM(RC[2],RC[4],RC[6]) -> 30.27 | AC31: =SUM(RC[2],RC[4],RC[6]) -> 0.25 | AD31: 0 | AE31: 0 | AF31: 0 | AG31: 0 | AH31: 30.27 | AI31: 0.25 | AJ31: 404.03 | AK31: 0.71
A32: MT | B32: PT0002000081997398TD | C32: PARQUE CENTRAL MAIA | D32: 14190000234365 | E32: 2019-03-20T00:00:00.000 | F32: 2019-03-31T00:00:00.000 | G32: =RC[-1]-RC[-2] -> 11 | H32: 1260.5 | I32: 1024.8 | J32: 37.58 | K32: 87.89 | L32: 232.5 | M32: 90.4 | N32: 1503.2 | Q32: 3727.97 | T32: 1889.41 | W32: 686.34 | Z32: =SUM(RC[-12],RC[-9],RC[-6],RC[-3]) -> 7806.92 | AA32: 582.41 | AB32: =SUM(RC[2],RC[4],RC[6]) -> 27.36 | AC32: =SUM(RC[2],RC[4],RC[6]) -> 0.22 | AD32: 0 | AE32: 0 | AF32: 0 | AG32: 0 | AH32: 27.36 | AI32: 0.22 | AJ32: 172.7 | AK32: 0.44
A33: MT | B33: PT0002000081997398TD | C33: PARQUE CENTRAL MAIA | D33: 14190000247531 | E33: 2019-04-01T00:00:00.000 | F33: 2019-04-19T00:00:00.000 | G33: =RC[-1]-RC[-2] -> 18 | H33: 1727.97 | I33: 1405.25 | J33: 37.369999999999997 | K33: 138.38 | L33: 232.5 | M33: 143.13 | N33: 1569.45 | Q33: 6508.19 | T33: 2642.9 | W33: 1144.51 | Z33: =SUM(RC[-12],RC[-9],RC[-6],RC[-3]) -> 11865.05 | AA33: 727.52 | AB33: =SUM(RC[2],RC[4],RC[6]) -> 9.2799999999999994 | AC33: =SUM(RC[2],RC[4],RC[6]) -> 0.08 | AD33: 0 | AE33: 0 | AF33: 0 | AG33: 0 | AH33: 9.2799999999999994 | AI33: 0.08 | AJ33: 241.4 | AK33: 0.46
A34: MT | B34: PT0002000081997398TD | C34: PARQUE CENTRAL MAIA | D34: 14190000325787 | E34: 2019-04-20T00:00:00.000 | F34: 2019-05-19T00:00:00.000 | G34: =RC[-1]-RC[-2] -> 29 | H34: 2650.16 | I34: 2155 | J34: 37.78 | K34: 220.91 | L34: 232.5 | M34: 225.99 | N34: 2040.2 | Q34: 9135.51 | T34: 5715.8 | W34: 1785.02 | Z34: =SUM(RC[-12],RC[-9],RC[-6],RC[-3]) -> 18676.530000000002 | AA34: 1127.95 | AB34: =SUM(RC[2],RC[4],RC[6]) -> 41.97 | AC34: =SUM(RC[2],RC[4],RC[6]) -> 0.34 | AD34: 0 | AE34: 0 | AF34: 0 | AG34: 0 | AH34: 41.97 | AI34: 0.34 | AJ34: 319.38 | AK34: 0.68
A35: MT | B35: PT0002000081997398TD | C35: PARQUE CENTRAL MAIA | D35: 14190000394921 | E35: 2019-05-20T00:00:00.000 | F35: 2019-06-11T00:00:00.000 | G35: =RC[-1]-RC[-2] -> 22 | H35: 2580.91 | I35: 2098.6999999999998 | J35: 42.15 | K35: 188.97 | L35: 232.5 | M35: 173.26 | N35: 2023.41 | Q35: 10038.51 | T35: 5004.6900000000005 | W35: 1575.46 | Z35: =SUM(RC[-12],RC[-9],RC[-6],RC[-3]) -> 18642.07 | AA35: 1135.77 | AB35: =SUM(RC[2],RC[4],RC[6]) -> 20.88 | AC35: =SUM(RC[2],RC[4],RC[6]) -> 0.17 | AD35: 0 | AE35: 0 | AF35: 0 | AG35: 0 | AH35: 20.88 | AI35: 0.17 | AJ35: 342.73 | AK35: 0.55000000000000004
A36: MT | B36: PT0002000081997398TD | C36: PARQUE CENTRAL MAIA | D36: 14190000512584 | E36: 2019-06-12T00:00:00.000 | F36: 2019-06-30T00:00:00.000 | G36: =RC[-1]-RC[-2] -> 18 | H36: 2064.2400000000002 | I36: 1678.25 | J36: 44.33 | K36: 164.16 | L36: 232.5 | M36: 143.13 | N36: 1595.87 | Q36: 7793.12 | T36: 4211.8599999999997 | W36: 1217.58 | Z36: =SUM(RC[-12],RC[-9],RC[-6],RC[-3]) -> 14818.429999999998 | AA36: 900.71999999999991 | AB36: =SUM(RC[2],RC[4],RC[6]) -> 0.68 | AC36: =SUM(RC[2],RC[4],RC[6]) -> 0.01 | AD36: 0 | AE36: 0 | AF36: 0 | AG36: 0 | AH36: 0.68 | AI36: 0.01 | AJ36: 361.2 | AK36: 0.5
A37: MT | B37: PT0002000081997398TD | C37: PARQUE CENTRAL MAIA | D37: 14190000537018 | E37: 2019-07-01T00:00:00.000 | F37: 2019-08-11T00:00:00.000 | G37: =RC[-1]-RC[-2] -> 41 | H37: 5218.03 | I37: 4243.09 | J37: 45.18 | K37: 369.84 | L37: 232.5 | M37: 316.39 | N37: 4066.25 | Q37: 20144.79 | T37: 10271.18 | W37: 3211.37 | Z37: =SUM(RC[-12],RC[-9],RC[-6],RC[-3]) -> 37693.590000000004 | AA37: 2347.13 | AB37: =SUM(RC[2],RC[4],RC[6]) -> 0 | AC37: =SUM(RC[2],RC[4],RC[6]) -> 0 | AD37: 0 | AE37: 0 | AF37: 0 | AG37: 0 | AH37: 0 | AI37: 0 | AJ37: 1095.68 | AK37: 1.24
A38: MT | B38: PT0002000081997398TD | C38: PARQUE CENTRAL MAIA | D38: 14190000613395 | E38: 2019-08-12T00:00:00.000 | F38: 2019-09-11T00:00:00.000 | G38: =RC[-1]-RC[-2] -> 30 | H38: 3223.13 | I38: 2620.8200000000002 | J38: 40.160000000000004 | K38: 242.66 | L38: 232.5 | M38: 233.52 | N38: 2650.71 | Q38: 12565.62 | T38: 5225.96 | W38: 1978.99 | Z38: =SUM(RC[-12],RC[-9],RC[-6],RC[-3]) -> 22421.280000000002 | AA38: 1402.9099999999999 | AB38: =SUM(RC[2],RC[4],RC[6]) -> 9.11 | AC38: =SUM(RC[2],RC[4],RC[6]) -> 7.0000000000000007E-2 | AD38: 0 | AE38: 0 | AF38: 0 | AG38: 0 | AH38: 9.11 | AI38: 7.0000000000000007E-2 | AJ38: 730.6 | AK38: 1.07
A39: MT | B39: PT0002000081997398TD | C39: PARQUE CENTRAL MAIA | D39: 14190000682474 | E39: 2019-09-12T00:00:00.000 | F39: 2019-09-30T00:00:00.000 | G39: =RC[-1]-RC[-2] -> 18 | H39: 1723.7 | I39: 1401.38 | J39: 33.85 | K39: 125.33 | L39: 232.5 | M39: 143.13 | N39: 1319.95 | Q39: 6522.5 | T39: 2875.09 | W39: 1240.6000000000001 | Z39: =SUM(RC[-12],RC[-9],RC[-6],RC[-3]) -> 11958.140000000001 | AA39: 745.87 | AB39: =SUM(RC[2],RC[4],RC[6]) -> 0 | AC39: =SUM(RC[2],RC[4],RC[6]) -> 0 | AD39: 0 | AE39: 0 | AF39: 0 | AG39: 0 | AH39: 0 | AI39: 0 | AJ39: 576.98 | AK39: 1.33
A40: MT | B40: PT0002000081997398TD | C40: PARQUE CENTRAL MAIA | D40: 14190000691190 | E40: 2019-10-01T00:00:00.000 | F40: 2019-10-11T00:00:00.000 | G40: =RC[-1]-RC[-2] -> 10 | H40: 989.67 | I40: 805 | J40: 32.9 | K40: 70.540000000000006 | L40: 232.5 | M40: 82.86 | N40: 888.41 | Q40: 4093.86 | T40: 1317.75 | W40: 702.97 | Z40: =SUM(RC[-12],RC[-9],RC[-6],RC[-3]) -> 7002.9900000000007 | AA40: 0 | AB40: =SUM(RC[2],RC[4],RC[6]) -> 0 | AC40: =SUM(RC[2],RC[4],RC[6]) -> 0 | AD40: 0 | AE40: 0 | AF40: 0 | AG40: 0 | AH40: 0 | AI40: 0 | AJ40: 246.13 | AK40: 0.48
A41: MT | B41: PT0002000081997398TD | C41: PARQUE CENTRAL MAIA | D41: 14190000750567 | E41: 2019-10-12T00:00:00.000 | F41: 2019-11-11T00:00:00.000 | G41: =RC[-1]-RC[-2] -> 30 | H41: 2847.3 | I41: 2315.27 | J41: 38.22 | K41: 230.91 | L41: 232.5 | M41: 233.52 | N41: 3057.44 | Q41: 10942.23 | T41: 5532 | W41: 1864.89 | Z41: =SUM(RC[-12],RC[-9],RC[-6],RC[-3]) -> 21396.559999999998 | AA41: 0 | AB41: =SUM(RC[2],RC[4],RC[6]) -> 0 | AC41: =SUM(RC[2],RC[4],RC[6]) -> 0 | AD41: 0 | AE41: 0 | AF41: 0 | AG41: 0 | AH41: 0 | AI41: 0 | AJ41: 743.98 | AK41: 1.72
A42: MT | B42: PT0002000081997398TD | C42: PARQUE CENTRAL MAIA | D42: 14190000822411 | E42: 2019-11-12T00:00:00.000 | F42: 2019-12-11T00:00:00.000 | G42: =RC[-1]-RC[-2] -> 29 | H42: 3072.61 | I42: 2498.4500000000003 | J42: 37.56 | K42: 219.6 | L42: 232.5 | M42: 225.99 | N42: 4131.3 | Q42: 11276.19 | T42: 4928.7300000000005 | W42: 1964.28 | Z42: =SUM(RC[-12],RC[-9],RC[-6],RC[-3]) -> 22300.5 | AA42: 0 | AB42: =SUM(RC[2],RC[4],RC[6]) -> 0 | AC42: =SUM(RC[2],RC[4],RC[6]) -> 0 | AD42: 0 | AE42: 0 | AF42: 0 | AG42: 0 | AH42: 0 | AI42: 0 | AJ42: 327.23 | AK42: 0.2
A43: MT | B43: PT0002000081997398TD | C43: PARQUE CENTRAL MAIA | D43: 14200000041520 | E43: 2019-12-12T00:00:00.000 | F43: 2020-01-02T00:00:00.000 | G43: =RC[-1]-RC[-2] -> 21 | H43: 1835.29 | I43: 1492.5 | J43: 37.840000000000003 | K43: 160.52000000000001 | L43: 232.5 | M43: 164.94 | N43: 2649.11 | Q43: 7313.73 | T43: 4905.01 | W43: 1424.93 | Z43: =SUM(RC[-12],RC[-9],RC[-6],RC[-3]) -> 16292.78 | AA43: 0 | AB43: =SUM(RC[2],RC[4],RC[6]) -> 30.59 | AC43: =SUM(RC[2],RC[4],RC[6]) -> 0.25 | AD43: 0 | AE43: 0 | AF43: 0 | AG43: 0 | AH43: 30.59 | AI43: 0.25 | AJ43: 8.370000000000001 | AK43: 0.15
G44: =SUM(R[-16]C:R[-1]C) -> 363 | H44: =SUM(R[-16]C:R[-1]C) -> 40601.600000000006 | I44: =SUM(R[-16]C:R[-1]C) -> 33014.57 | J44: =AVERAGE(R[-16]C:R[-1]C) -> 39.669375000000009 | K44: =SUM(R[-16]C:R[-1]C) -> 2955.4599999999996 | L44: =AVERAGE(R[-16]C:R[-1]C) -> 232.5 | M44: =SUM(R[-16]C:R[-1]C) -> 2861.2000000000003 | N44: =SUM(R[-16]C:R[-1]C) -> 40228.450000000004 | Q44: =SUM(R[-16]C:R[-1]C) -> 143326.20000000001 | T44: =SUM(R[-16]C:R[-1]C) -> 75197.37999999999 | W44: =SUM(R[-16]C:R[-1]C) -> 28643.81 | Z44: =SUM(R[-16]C:R[-1]C) -> 287395.84000000003 | AA44: =SUM(R[-16]C:R[-1]C) -> 14324.480000000001 | AB44: =SUM(R[-16]C:R[-1]C) -> 177.82000000000002 | AC44: =SUM(R[-16]C:R[-1]C) -> 1.45 | AD44: =SUM(R[-16]C:R[-1]C) -> 0 | AE44: =SUM(R[-16]C:R[-1]C) -> 0 | AF44: =SUM(R[-16]C:R[-1]C) -> 0 | AG44: =SUM(R[-16]C:R[-1]C) -> 0 | AH44: =SUM(R[-16]C:R[-1]C) -> 177.82000000000002 | AI44: =SUM(R[-16]C:R[-1]C) -> 1.45 | AJ44: =SUM(R[-16]C:R[-1]C) -> 7724.6000000000013 | AK44: =SUM(R[-16]C:R[-1]C) -> 14.240000000000002
A45: MT | B45: PT0002000081997398TD | C45: PARQUE CENTRAL MAIA | D45: RN20Z807742 | E45: 2020-01-03T00:00:00.000 | F45: 2020-01-31T00:00:00.000 | G45: 29 | H45: 3103.19 | I45: 2520.61 | J45: 35.03 | K45: 174.42 | L45: 232.49 | M45: 206.99 | N45: 3678 | O45: 7.6399999999999996E-2 | P45: 5.67E-2 | Q45: 10144 | R45: 7.0099999999999996E-2 | S45: 4.07E-2 | T45: 4690 | U45: 6.3E-2 | V45: 1.46E-2 | W45: 1988 | X45: 5.7000000000000002E-2 | Y45: 1.4E-2 | Z45: 20500 | AA45: 2118.58 | AB45: 3283 | AC45: 0 | AD45: 0 | AE45: 0 | AF45: 0 | AG45: 0 | AH45: 0 | AI45: 0 | AJ45: 7 | AK45: 0.13
A46: MT | B46: PT0002000081997398TD | C46: PARQUE CENTRAL MAIA | D46: RS200801981 | E46: 2020-01-03T00:00:00.000 | F46: 2020-01-31T00:00:00.000 | G46: -29 | H46: -3103.19 | I46: -2520.61 | J46: -35.03 | K46: -174.42 | L46: -232.49 | M46: -206.99 | N46: -3678 | O46: 7.6399999999999996E-2 | P46: 5.67E-2 | Q46: -10144 | R46: 7.0099999999999996E-2 | S46: 4.07E-2 | T46: -4690 | U46: 6.3E-2 | V46: 1.46E-2 | W46: -1988 | X46: 5.7000000000000002E-2 | Y46: 1.4E-2 | Z46: -20500 | AA46: -2118.58 | AB46: -3283 | AC46: 0 | AD46: 0 | AE46: 0 | AF46: 0 | AG46: 0 | AH46: 0 | AI46: 0 | AJ46: -7 | AK46: -0.13
A47: MT | B47: PT0002000081997398TD | C47: PARQUE CENTRAL MAIA | D47: RY200801981 | E47: 2020-01-03T00:00:00.000 | F47: 2020-01-31T00:00:00.000 | G47: 29 | H47: 3014.95 | I47: 2448.87 | J47: 35.03 | K47: 174.42 | L47: 232.49 | M47: 206.99 | N47: 3678 | O47: 7.2900000000000006E-2 | P47: 5.67E-2 | Q47: 10144 | R47: 6.6600000000000006E-2 | S47: 4.07E-2 | T47: 4690 | U47: 5.9499999999999997E-2 | V47: 1.46E-2 | W47: 1988 | X47: 5.3499999999999999E-2 | Y47: 1.4E-2 | Z47: 20500 | AA47: 2046.84 | AB47: 3283 | AC47: 0 | AD47: 0 | AE47: 0 | AF47: 0 | AG47: 0 | AH47: 0 | AI47: 0 | AJ47: 7 | AK47: 0.13
A48: MT | B48: PT0002000081997398TD | C48: PARQUE CENTRAL MAIA | D48: RN20Z812056 | E48: 2020-02-01T00:00:00.000 | F48: 2020-02-29T00:00:00.000 | G48: 29 | H48: 3329.64 | I48: 2704.57 | J48: 42.05 | K48: 209.38 | L48: 232.49 | M48: 206.99 | N48: 4205 | O48: 7.6399999999999996E-2 | P48: 5.67E-2 | Q48: 10662 | R48: 7.0099999999999996E-2 | S48: 4.07E-2 | T48: 5173 | U48: 6.3E-2 | V48: 1.46E-2 | W48: 1739 | X48: 5.7000000000000002E-2 | Y48: 1.4E-2 | Z48: 21779 | AA48: 2265.9299999999998 | AB48: 3699 | AC48: 0.26 | AD48: 0 | AE48: 0 | AF48: 0 | AG48: 0 | AH48: 31.7 | AI48: 0.26 | AJ48: 12 | AK48: 0.23
A49: MT | B49: PT0002000081997398TD | C49: PARQUE CENTRAL MAIA | D49: RS200801982 | E49: 2020-02-01T00:00:00.000 | F49: 2020-02-29T00:00:00.000 | G49: -29 | H49: -3329.64 | I49: -2704.57 | J49: -42.05 | K49: -209.38 | L49: -232.49 | M49: -206.99 | N49: -4205 | O49: 7.6399999999999996E-2 | P49: 5.67E-2 | Q49: -10662 | R49: 7.0099999999999996E-2 | S49: 4.07E-2 | T49: -5173 | U49: 6.3E-2 | V49: 1.46E-2 | W49: -1739 | X49: 5.7000000000000002E-2 | Y49: 1.4E-2 | Z49: -21779 | AA49: -2265.9299999999998 | AB49: -3699 | AC49: -0.26 | AD49: 0 | AE49: 0 | AF49: 0 | AG49: 0 | AH49: -31.7 | AI49: -0.26 | AJ49: -12 | AK49: -0.23
A50: MT | B50: PT0002000081997398TD | C50: PARQUE CENTRAL MAIA | D50: RY200801982 | E50: 2020-02-01T00:00:00.000 | F50: 2020-02-29T00:00:00.000 | G50: 29 | H50: 3235.88 | I50: 2628.35 | J50: 42.05 | K50: 209.38 | L50: 232.49 | M50: 206.99 | N50: 4205 | O50: 7.2900000000000006E-2 | P50: 5.67E-2 | Q50: 10662 | R50: 6.6600000000000006E-2 | S50: 4.07E-2 | T50: 5173 | U50: 5.9499999999999997E-2 | V50: 1.46E-2 | W50: 1739 | X50: 5.3499999999999999E-2 | Y50: 1.4E-2 | Z50: 21779 | AA50: 2189.6999999999998 | AB50: 3699 | AC50: 0.26 | AD50: 0 | AE50: 0 | AF50: 0 | AG50: 0 | AH50: 31.7 | AI50: 0.26 | AJ50: 12 | AK50: 0.23
A51: MT | B51: PT0002000081997398TD | C51: PARQUE CENTRAL MAIA | D51: RN20Z816042 | E51: 2020-03-01T00:00:00.000 | F51: 2020-03-31T00:00:00.000 | G51: 31 | H51: 2891.45 | I51: 2348.3000000000002 | J51: 33.65 | K51: 179.11 | L51: 232.5 | M51: 221.27 | N51: 3567 | O51: 7.6399999999999996E-2 | P51: 5.67E-2 | Q51: 8944 | R51: 7.0099999999999996E-2 | S51: 4.07E-2 | T51: 4470 | U51: 6.3E-2 | V51: 1.46E-2 | W51: 1618 | X51: 5.7000000000000002E-2 | Y51: 1.4E-2 | Z51: 18599 | AA51: 1927.51 | AB51: 3123 | AC51: 0 | AD51: 0 | AE51: 0 | AF51: 0 | AG51: 0 | AH51: 0 | AI51: 0 | AJ51: 97 | AK51: 1.83
A52: MT | B52: PT0002000081997398TD | C52: PARQUE CENTRAL MAIA | D52: RS200801983 | E52: 2020-03-01T00:00:00.000 | F52: 2020-03-31T00:00:00.000 | G52: -31 | H52: -2891.45 | I52: -2348.3000000000002 | J52: -33.65 | K52: -179.11 | L52: -232.5 | M52: -221.27 | N52: -3567 | O52: 7.6399999999999996E-2 | P52: 5.67E-2 | Q52: -8944 | R52: 7.0099999999999996E-2 | S52: 4.07E-2 | T52: -4470 | U52: 6.3E-2 | V52: 1.46E-2 | W52: -1618 | X52: 5.7000000000000002E-2 | Y52: 1.4E-2 | Z52: -18599 | AA52: -1927.51 | AB52: -3123 | AC52: 0 | AD52: 0 | AE52: 0 | AF52: 0 | AG52: 0 | AH52: 0 | AI52: 0 | AJ52: -97 | AK52: -1.83
A53: MT | B53: PT0002000081997398TD | C53: PARQUE CENTRAL MAIA | D53: RY200801983 | E53: 2020-03-01T00:00:00.000 | F53: 2020-03-31T00:00:00.000 | G53: 31 | H53: 2811.38 | I53: 2283.2199999999998 | J53: 33.65 | K53: 179.11 | L53: 232.5 | M53: 221.27 | N53: 3567 | O53: 7.2900000000000006E-2 | P53: 5.67E-2 | Q53: 8944 | R53: 6.6600000000000006E-2 | S53: 4.07E-2 | T53: 4470 | U53: 5.9499999999999997E-2 | V53: 1.46E-2 | W53: 1618 | X53: 5.3499999999999999E-2 | Y53: 1.4E-2 | Z53: 18599 | AA53: 1862.41 | AB53: 3123 | AC53: 0 | AD53: 0 | AE53: 0 | AF53: 0 | AG53: 0 | AH53: 0 | AI53: 0 | AJ53: 97 | AK53: 1.83
A54: MT | B54: PT0002000081997398TD | C54: PARQUE CENTRAL MAIA | D54: RN20Z820839 | E54: 2020-04-01T00:00:00.000 | F54: 2020-04-30T00:00:00.000 | G54: 30 | H54: 2305.6799999999998 | I54: 1872.09 | J54: 27 | K54: 139.08000000000001 | L54: 232.5 | M54: 214.13 | N54: 1701 | O54: 7.2900000000000006E-2 | P54: 5.6399999999999999E-2 | Q54: 7984 | R54: 6.6600000000000006E-2 | S54: 4.0399999999999998E-2 | T54: 4358 | U54: 5.9499999999999997E-2 | V54: 1.4500000000000001E-2 | W54: 1541 | X54: 5.3499999999999999E-2 | Y54: 1.41E-2 | Z54: 15584 | AA54: 1500.88 | AB54: 2610 | AC54: 0.03 | AD54: 0 | AE54: 0 | AF54: 0 | AG54: 0 | AH54: 4.0999999999999996 | AI54: 0.03 | AJ54: 126 | AK54: 2.38
A55: MT | B55: PT0002000081997398TD | C55: PARQUE CENTRAL MAIA | D55: RN20Z823999 | E55: 2020-05-01T00:00:00.000 | F55: 2020-05-31T00:00:00.000 | G55: 31 | H55: 2521.6 | I55: 2047.61 | J55: 29.23 | K55: 155.6 | L55: 232.5 | M55: 221.27 | N55: 1754 | O55: 7.2900000000000006E-2 | P55: 5.6399999999999999E-2 | Q55: 8742 | R55: 6.6600000000000006E-2 | S55: 4.0399999999999998E-2 | T55: 5087 | U55: 5.9499999999999997E-2 | V55: 1.4500000000000001E-2 | W55: 1667 | X55: 5.3499999999999999E-2 | Y55: 1.41E-2 | Z55: 17250 | AA55: 1651.32 | AB55: 2583 | AC55: 0 | AD55: 0 | AE55: 0 | AF55: 0 | AG55: 0 | AH55: 0 | AI55: 0 | AJ55: 116 | AK55: 2.19
A56: MT | B56: PT0002000081997398TD | C56: PARQUE CENTRAL MAIA | D56: RN20Z828295 | E56: 2020-06-01T00:00:00.000 | F56: 2020-06-30T00:00:00.000 | G56: 30 | H56: 2560.62 | I56: 2079.35 | J56: 31.22 | K56: 160.80000000000001 | L56: 232.5 | M56: 214.13 | N56: 1873 | O56: 7.2900000000000006E-2 | P56: 5.6399999999999999E-2 | Q56: 9029 | R56: 6.6600000000000006E-2 | S56: 4.0399999999999998E-2 | T56: 4940 | U56: 5.9499999999999997E-2 | V56: 1.4500000000000001E-2 | W56: 1628 | X56: 5.3499999999999999E-2 | Y56: 1.41E-2 | Z56: 17470 | AA56: 1683.89 | AB56: 2432 | AC56: 0 | AD56: 0 | AE56: 0 | AF56: 0 | AG56: 0 | AH56: 0 | AI56: 0 | AJ56: 162 | AK56: 3.06
A57: MT | B57: PT0002000081997398TD | C57: PARQUE CENTRAL MAIA | D57: RN20Z832510 | E57: 2020-07-01T00:00:00.000 | F57: 2020-07-31T00:00:00.000 | G57: 31 | H57: 2791.1 | I57: 2266.7399999999998 | J57: 32.17 | K57: 171.25 | L57: 232.5 | M57: 221.27 | N57: 2220 | O57: 7.2900000000000006E-2 | P57: 5.6399999999999999E-2 | Q57: 10681 | R57: 6.6600000000000006E-2 | S57: 4.0399999999999998E-2 | T57: 4092 | U57: 5.9499999999999997E-2 | V57: 1.4500000000000001E-2 | W57: 1783 | X57: 5.3499999999999999E-2 | Y57: 1.41E-2 | Z57: 18776 | AA57: 1853.24 | AB57: 2817 | AC57: 0 | AD57: 0 | AE57: 0 | AF57: 0 | AG57: 0 | AH57: 0 | AI57: 0 | AJ57: 116 | AK57: 2.19
A58: MT | B58: PT0002000081997398TD | C58: PARQUE CENTRAL MAIA | D58: RN20Z836006 | E58: 2020-08-01T00:00:00.000 | F58: 2020-08-31T00:00:00.000 | G58: 31 | H58: 2958.38 | I58: 2402.7399999999998 | J58: 36.51 | K58: 194.32 | L58: 232.5 | M58: 221.27 | N58: 2300 | O58: 7.2900000000000006E-2 | P58: 5.6399999999999999E-2 | Q58: 10714 | R58: 6.6600000000000006E-2 | S58: 4.0399999999999998E-2 | T58: 5398 | U58: 5.9499999999999997E-2 | V58: 1.4500000000000001E-2 | W58: 1791 | X58: 5.3499999999999999E-2 | Y58: 1.41E-2 | Z58: 20203 | AA58: 1964.31 | AB58: 3034 | AC58: 0 | AD58: 0 | AE58: 0 | AF58: 0 | AG58: 0 | AH58: 0 | AI58: 0 | AJ58: 139 | AK58: 2.63
A59: MT | B59: PT0002000081997398TD | C59: PARQUE CENTRAL MAIA | D59: RN20Z838508 | E59: 2020-09-01T00:00:00.000 | F59: 2020-09-30T00:00:00.000 | G59: 30 | H59: 2884.41 | I59: 2342.61 | J59: 36.58 | K59: 188.4 | L59: 232.5 | M59: 214.13 | N59: 2414 | O59: 7.2900000000000006E-2 | P59: 5.6399999999999999E-2 | Q59: 11023 | R59: 6.6600000000000006E-2 | S59: 4.0399999999999998E-2 | T59: 4291 | U59: 5.9499999999999997E-2 | V59: 1.4500000000000001E-2 | W59: 1612 | X59: 5.3499999999999999E-2 | Y59: 1.41E-2 | Z59: 19340 | AA59: 1918.09 | AB59: 3116 | AC59: 0 | AD59: 0 | AE59: 0 | AF59: 0 | AG59: 0 | AH59: 0 | AI59: 0 | AJ59: 139 | AK59: 2.63
A60: MT | B60: PT0002000081997398TD | C60: PARQUE CENTRAL MAIA | D60: RN20Z843489 | E60: 2020-10-01T00:00:00.000 | F60: 2020-10-31T00:00:00.000 | G60: 31 | H60: 2629.89 | I60: 2135.65 | J60: 30.34 | K60: 161.5 | L60: 232.5 | M60: 221.27 | N60: 2215 | O60: 7.2900000000000006E-2 | P60: 5.67E-2 | Q60: 9336 | R60: 6.6600000000000006E-2 | S60: 4.07E-2 | T60: 4479 | U60: 5.9499999999999997E-2 | V60: 1.46E-2 | W60: 1616 | X60: 5.3499999999999999E-2 | Y60: 1.4E-2 | Z60: 17646 | AA60: 1729.79 | AB60: 2512 | AC60: 0 | AD60: 0 | AE60: 0 | AF60: 0 | AG60: 0 | AH60: 0 | AI60: 0 | AJ60: 289 | AK60: 5.46
A61: MT | B61: PT0002000081997398TD | C61: PARQUE CENTRAL MAIA | D61: RN20Z847859 | E61: 2020-11-01T00:00:00.000 | F61: 2020-11-30T00:00:00.000 | G61: 30 | H61: 2244.44 | I61: 1822.3 | J61: 24.9 | K61: 128.24 | L61: 232.5 | M61: 214.13 | N61: 2614 | O61: 7.2900000000000006E-2 | P61: 5.67E-2 | Q61: 6905 | R61: 6.6600000000000006E-2 | S61: 4.07E-2 | T61: 3733 | U61: 5.9499999999999997E-2 | V61: 1.46E-2 | W61: 1541 | X61: 5.3499999999999999E-2 | Y61: 1.4E-2 | Z61: 14793 | AA61: 1460.29 | AB61: 2274 | AC61: 0 | AD61: 0 | AE61: 0 | AF61: 0 | AG61: 0 | AH61: 0 | AI61: 0 | AJ61: 256 | AK61: 4.84
A62: MT | B62: PT0002000081997398TD | C62: PARQUE CENTRAL MAIA | D62: RN21Z802292 | E62: 2020-12-01T00:00:00.000 | F62: 2020-12-31T00:00:00.000 | G62: 31 | H62: 2678.31 | I62: 2175.04 | J62: 32.21 | K62: 171.44 | L62: 232.5 | M62: 221.27 | N62: 3221 | O62: 7.2900000000000006E-2 | P62: 5.67E-2 | Q62: 7978 | R62: 6.6600000000000006E-2 | S62: 4.07E-2 | T62: 5235 | U62: 5.9499999999999997E-2 | V62: 1.46E-2 | W62: 1501 | X62: 5.3499999999999999E-2 | Y62: 1.4E-2 | Z62: 17935 | AA62: 1762.69 | AB62: 2771 | AC62: 0.05 | AD62: 0 | AE62: 0 | AF62: 0 | AG62: 0 | AH62: 6.3 | AI62: 0.05 | AJ62: 87 | AK62: 1.64
G63: =SUM(R[-18]C:R[-1]C) -> 364 | H63: =SUM(R[-18]C:R[-1]C) -> 32636.639999999999 | I63: =SUM(R[-18]C:R[-1]C) -> 26504.570000000003 | J63: =AVERAGE(R[-18]C:R[-1]C) -> 21.716111111111104 | K63: =SUM(R[-18]C:R[-1]C) -> 2033.5400000000002 | L63: =AVERAGE(R[-18]C:R[-1]C) -> 154.9988888888889 | M63: =SUM(R[-18]C:R[-1]C) -> 2598.1200000000003 | N63: =SUM(R[-18]C:R[-1]C) -> 31762 | O63: =AVERAGE(R[-18]C:R[-1]C) -> 7.4066666666666656E-2 | P63: =AVERAGE(R[-18]C:R[-1]C) -> 5.6599999999999998E-2 | Q63: =SUM(R[-18]C:R[-1]C) -> 112142 | R63: =AVERAGE(R[-18]C:R[-1]C) -> 6.7766666666666669E-2 | S63: =AVERAGE(R[-18]C:R[-1]C) -> 4.0599999999999997E-2 | T63: =SUM(R[-18]C:R[-1]C) -> 55946 | U63: =AVERAGE(R[-18]C:R[-1]C) -> 6.0666666666666674E-2 | V63: =AVERAGE(R[-18]C:R[-1]C) -> 1.4566666666666669E-2 | W63: =SUM(R[-18]C:R[-1]C) -> 20025 | X63: =AVERAGE(R[-18]C:R[-1]C) -> 5.4666666666666669E-2 | Y63: =AVERAGE(R[-18]C:R[-1]C) -> 1.4033333333333335E-2 | Z63: =SUM(R[-18]C:R[-1]C) -> 219875 | AA63: =SUM(R[-18]C:R[-1]C) -> 21623.449999999997 | AB63: =SUM(R[-18]C:R[-1]C) -> 34254 | AC63: =SUM(R[-18]C:R[-1]C) -> 0.34 | AD63: =SUM(R[-18]C:R[-1]C) -> 0 | AE63: =SUM(R[-18]C:R[-1]C) -> 0 | AF63: =SUM(R[-18]C:R[-1]C) -> 0 | AG63: =SUM(R[-18]C:R[-1]C) -> 0 | AH63: =SUM(R[-18]C:R[-1]C) -> 42.099999999999994 | AI63: =SUM(R[-18]C:R[-1]C) -> 0.34 | AJ63: =SUM(R[-18]C:R[-1]C) -> 1546 | AK63: =SUM(R[-18]C:R[-1]C) -> 29.21
A64: MT | B64: PT0002000081997398TD | C64: PARQUE CENTRAL MAIA | D64: RN21Z805983 | E64: 2021-01-01T00:00:00.000 | F64: 2021-01-31T00:00:00.000 | G64: 31 | H64: 2849.4 | I64: 2314.13 | J64: 34.880000000000003 | K64: 193.66 | L64: 232.5 | M64: 245.78 | N64: 3488 | O64: 7.2900000000000006E-2 | P64: 5.5E-2 | Q64: 8737 | R64: 6.6600000000000006E-2 | S64: 3.9699999999999999E-2 | T64: 5045 | U64: 5.9499999999999997E-2 | V64: 1.43E-2 | W64: 1610 | X64: 5.3499999999999999E-2 | Y64: 1.3599999999999999E-2 | Z64: 18880 | AA64: 1855.22 | AB64: 2620 | AC64: 0 | AD64: 0 | AE64: 0 | AF64: 0 | AG64: 0 | AH64: 0 | AI64: 0 | AJ64: 31 | AK64: 0.59
A65: MT | B65: PT0002000081997398TD | C65: PARQUE CENTRAL MAIA | D65: RN21Z812183 | E65: 2021-02-01T00:00:00.000 | F65: 2021-02-28T00:00:00.000 | G65: 28 | H65: 2537.2399999999998 | I65: 2060.35 | J65: 34.97 | K65: 175.37 | L65: 232.5 | M65: 221.99 | N65: 3497 | O65: 7.2900000000000006E-2 | P65: 5.5E-2 | Q65: 8009 | R65: 6.6600000000000006E-2 | S65: 3.9699999999999999E-2 | T65: 3533 | U65: 5.9499999999999997E-2 | V65: 1.43E-2 | W65: 1293 | X65: 5.3499999999999999E-2 | Y65: 1.3599999999999999E-2 | Z65: 16332 | AA65: 1646.12 | AB65: 3128 | AC65: 0.32 | AD65: 0 | AE65: 0 | AF65: 7.6 | AG65: 0.19 | AH65: 15.5 | AI65: 0.13 | AJ65: 11 | AK65: 0.21
A66: MT | B66: PT0002000081997398TD | C66: PARQUE CENTRAL MAIA | D66: RN21Z817440 | E66: 2021-03-01T00:00:00.000 | F66: 2021-03-31T00:00:00.000 | G66: 31 | H66: 2961.82 | I66: 2405.52 | J66: 36.590000000000003 | K66: 203.14 | L66: 232.5 | M66: 245.78 | N66: 3988 | O66: 7.2900000000000006E-2 | P66: 5.5E-2 | Q66: 9688 | R66: 6.6600000000000006E-2 | S66: 3.9699999999999999E-2 | T66: 4092 | U66: 5.9499999999999997E-2 | V66: 1.43E-2 | W66: 1420 | X66: 5.3499999999999999E-2 | Y66: 1.3599999999999999E-2 | Z66: 19188 | AA66: 1937.17 | AB66: 3630 | AC66: 0.08 | AD66: 0 | AE66: 0 | AF66: 0 | AG66: 0 | AH66: 9.3000000000000007 | AI66: 0.08 | AJ66: 9 | AK66: 0.17
A67: MT | B67: PT0002000081997398TD | C67: PARQUE CENTRAL MAIA | D67: RN21Z821483 | E67: 2021-04-01T00:00:00.000 | F67: 2021-04-30T00:00:00.000 | G67: 30 | H67: 2621.97 | I67: 2129.2199999999998 | J67: 37.6 | K67: 202.04 | L67: 232.5 | M67: 237.85 | N67: 2369 | O67: 7.2900000000000006E-2 | P67: 5.4800000000000001E-2 | Q67: 9388 | R67: 6.6600000000000006E-2 | S67: 3.9399999999999998E-2 | T67: 3990 | U67: 5.9499999999999997E-2 | V67: 1.4200000000000001E-2 | W67: 1197 | X67: 5.3499999999999999E-2 | Y67: 1.37E-2 | Z67: 16944 | AA67: 1672.16 | AB67: 3082 | AC67: 0.15 | AD67: 0 | AE67: 0 | AF67: 0 | AG67: 0 | AH67: 17.5 | AI67: 0.15 | AJ67: 5 | AK67: 0.09
A68: MT | B68: PT0002000081997398TD | C68: PARQUE CENTRAL MAIA | D68: RN21Z826704 | E68: 2021-05-01T00:00:00.000 | F68: 2021-05-31T00:00:00.000 | G68: 31 | H68: 2698 | I68: 2191.04 | J68: 36.520000000000003 | K68: 202.78 | L68: 232.5 | M68: 245.78 | N68: 2301 | O68: 7.2900000000000006E-2 | P68: 5.4800000000000001E-2 | Q68: 9538 | R68: 6.6600000000000006E-2 | S68: 3.9399999999999998E-2 | T68: 4498 | U68: 5.9499999999999997E-2 | V68: 1.4200000000000001E-2 | W68: 1303 | X68: 5.3499999999999999E-2 | Y68: 1.37E-2 | Z68: 17640 | AA68: 1723.92 | AB68: 3180 | AC68: 0.22 | AD68: 0 | AE68: 0 | AF68: 0 | AG68: 0 | AH68: 27 | AI68: 0.22 | AJ68: 37 | AK68: 0.7
A69: MT | B69: PT0002000081997398TD | C69: PARQUE CENTRAL MAIA | D69: RN21Z831601 | E69: 2021-06-01T00:00:00.000 | F69: 2021-06-30T00:00:00.000 | G69: 30 | H69: 2484.4699999999998 | I69: 2017.43 | J69: 35 | K69: 188.06 | L69: 232.5 | M69: 237.85 | N69: 2100 | O69: 7.2900000000000006E-2 | P69: 5.4800000000000001E-2 | Q69: 8658 | R69: 6.6600000000000006E-2 | S69: 3.9399999999999998E-2 | T69: 4201 | U69: 5.9499999999999997E-2 | V69: 1.4200000000000001E-2 | W69: 1158 | X69: 5.3499999999999999E-2 | Y69: 1.37E-2 | Z69: 16117 | AA69: 1573.34 | AB69: 3205 | AC69: 0.6 | AD69: 0 | AE69: 0 | AF69: 0 | AG69: 0 | AH69: 71.599999999999994 | AI69: 0.6 | AJ69: 78 | AK69: 1.47
A70: MT | B70: PT0002000081997398TD | C70: PARQUE CENTRAL MAIA | D70: RN21Z833282 | E70: 2021-07-01T00:00:00.000 | F70: 2021-07-31T00:00:00.000 | G70: 31 | H70: 2593.65 | I70: 2106.2199999999998 | J70: 33.82 | K70: 187.76 | L70: 232.5 | M70: 245.78 | N70: 2232 | O70: 7.2900000000000006E-2 | P70: 5.4800000000000001E-2 | Q70: 9552 | R70: 6.6600000000000006E-2 | S70: 3.9399999999999998E-2 | T70: 3680 | U70: 5.9499999999999997E-2 | V70: 1.4200000000000001E-2 | W70: 1262 | X70: 5.3499999999999999E-2 | Y70: 1.37E-2 | Z70: 16726 | AA70: 1653.56 | AB70: 3513 | AC70: 0.65 | AD70: 0 | AE70: 0 | AF70: 0 | AG70: 0 | AH70: 78.7 | AI70: 0.65 | AJ70: 91 | AK70: 1.72
A71: MT | B71: PT0002000081997398TD | C71: PARQUE CENTRAL MAIA | D71: RN21Z837496 | E71: 2021-08-01T00:00:00.000 | F71: 2021-08-31T00:00:00.000 | G71: 31 | H71: 2497.25 | I71: 2027.83 | J71: 31.08 | K71: 172.54 | L71: 232.5 | M71: 245.78 | N71: 2051 | O71: 7.2900000000000006E-2 | P71: 5.4800000000000001E-2 | Q71: 8897 | R71: 6.6600000000000006E-2 | S71: 3.9399999999999998E-2 | T71: 3960 | U71: 5.9499999999999997E-2 | V71: 1.4200000000000001E-2 | W71: 1419 | X71: 5.3499999999999999E-2 | Y71: 1.37E-2 | Z71: 16327 | AA71: 1592.2 | AB71: 3290 | AC71: 0.79 | AD71: 0 | AE71: 0 | AF71: 0 | AG71: 0 | AH71: 95.3 | AI71: 0.79 | AJ71: 10 | AK71: 0.19
A72: MT | B72: PT0002000081997398TD | C72: PARQUE CENTRAL MAIA | D72: RN21Z841788 | E72: 2021-09-01T00:00:00.000 | F72: 2021-09-30T00:00:00.000 | G72: 30 | H72: 2621.42 | I72: 2128.7800000000002 | J72: 35.97 | K72: 193.27 | L72: 232.5 | M72: 237.85 | N72: 2374 | O72: 7.2900000000000006E-2 | P72: 5.4800000000000001E-2 | Q72: 9641 | R72: 6.6600000000000006E-2 | S72: 3.9399999999999998E-2 | T72: 3653 | U72: 5.9499999999999997E-2 | V72: 1.4200000000000001E-2 | W72: 1278 | X72: 5.3499999999999999E-2 | Y72: 1.37E-2 | Z72: 16946 | AA72: 1680.21 | AB72: 3431 | AC72: 0.44 | AD72: 0 | AE72: 0 | AF72: 0 | AG72: 0 | AH72: 52.5 | AI72: 0.44 | AJ72: 3 | AK72: 0.06
A73: MT | B73: PT0002000081997398TD | C73: PARQUE CENTRAL MAIA | D73: RN21Z846342 | E73: 2021-10-01T00:00:00.000 | F73: 2021-10-31T00:00:00.000 | G73: 31 | H73: 2500.23 | I73: 2030.26 | J73: 33.479999999999997 | K73: 185.9 | L73: 232.5 | M73: 245.78 | N73: 2009 | O73: 7.2900000000000006E-2 | P73: 5.5E-2 | Q73: 8501 | R73: 6.6600000000000006E-2 | S73: 3.9699999999999999E-2 | T73: 4528 | U73: 5.9499999999999997E-2 | V73: 1.43E-2 | W73: 1289 | X73: 5.3499999999999999E-2 | Y73: 1.3599999999999999E-2 | Z73: 16327 | AA73: 1581.28 | AB73: 2936 | AC73: 0.3 | AD73: 0 | AE73: 0 | AF73: 0 | AG73: 0 | AH73: 35.5 | AI73: 0.3 | AJ73: 35 | AK73: 0.66
A74: MT | B74: PT0002000081997398TD | C74: PARQUE CENTRAL MAIA | D74: RN21Z852363 | E74: 2021-11-01T00:00:00.000 | F74: 2021-11-14T00:00:00.000 | G74: 14 | H74: 840.91 | I74: 682.52 | J74: 20.11 | K74: 50.43 | L74: 232.51 | M74: 111 | N74: 905 | O74: 7.2900000000000006E-2 | P74: 5.5E-2 | Q74: 2369 | R74: 6.6600000000000006E-2 | S74: 3.9699999999999999E-2 | T74: 1481 | U74: 5.9499999999999997E-2 | V74: 1.43E-2 | W74: 573 | X74: 5.3499999999999999E-2 | Y74: 1.3599999999999999E-2 | Z74: 5328 | AA74: 515.33000000000004 | AB74: 813 | AC74: 0 | AD74: 0 | AE74: 0 | AF74: 0 | AG74: 0 | AH74: 0 | AI74: 0 | AJ74: 23 | AK74: 0.43
A75: MT | B75: PT0002000081997398TD | C75: PARQUE CENTRAL MAIA | D75: RN21Z852998 | E75: 2021-11-15T00:00:00.000 | F75: 2021-11-30T00:00:00.000 | G75: 16 | H75: 2767.47 | I75: 2248.65 | J75: 29.83 | K75: 85.49 | L75: 232.5 | M75: 126.85 | N75: 1790 | O75: 0.2404 | P75: 5.5E-2 | Q75: 4099 | R75: 0.2223 | S75: 3.9699999999999999E-2 | T75: 1376 | U75: 0.1963 | V75: 1.43E-2 | W75: 666 | X75: 0.1898 | Y75: 1.3599999999999999E-2 | Z75: 7931 | AA75: 2027.97 | AB75: 1450 | AC75: 0 | AD75: 0 | AE75: 0 | AF75: 0 | AG75: 0 | AH75: 0 | AI75: 0 | AJ75: 23 | AK75: 0.43
A76: MT | B76: PT0002000081997398TD | C76: PARQUE CENTRAL MAIA | D76: RN22Z801439 | E76: 2021-12-01T00:00:00.000 | F76: 2021-12-31T00:00:00.000 | G76: 31 | H76: 4608.32 | I76: 3744.13 | J76: 21.73 | K76: 120.67 | L76: 232.5 | M76: 245.78 | N76: 2282 | O76: 0.2404 | P76: 5.5E-2 | Q76: 5816 | R76: 0.2223 | S76: 3.9699999999999999E-2 | T76: 4032 | U76: 0.1963 | V76: 1.43E-2 | W76: 1555 | X76: 0.1898 | Y76: 1.3599999999999999E-2 | Z76: 13685 | AA76: 3363.33 | AB76: 2001 | AC76: 0 | AD76: 0 | AE76: 0 | AF76: 0 | AG76: 0 | AH76: 0 | AI76: 0 | AJ76: 36 | AK76: 0.68
G77: =SUM(R[-13]C:R[-1]C) -> 365 | H77: =SUM(R[-13]C:R[-1]C) -> 34582.15 | I77: =SUM(R[-13]C:R[-1]C) -> 28086.079999999998 | J77: =AVERAGE(R[-13]C:R[-1]C) -> 32.42923076923077 | K77: =SUM(R[-13]C:R[-1]C) -> 2161.11 | L77: =AVERAGE(R[-13]C:R[-1]C) -> 232.50076923076924 | M77: =SUM(R[-13]C:R[-1]C) -> 2893.8500000000004 | N77: =SUM(R[-13]C:R[-1]C) -> 31386 | O77: =AVERAGE(R[-13]C:R[-1]C) -> 9.8669230769230759E-2 | P77: =AVERAGE(R[-13]C:R[-1]C) -> 5.4907692307692324E-2 | Q77: =SUM(R[-13]C:R[-1]C) -> 102893 | R77: =AVERAGE(R[-13]C:R[-1]C) -> 9.0553846153846151E-2 | S77: =AVERAGE(R[-13]C:R[-1]C) -> 3.956153846153846E-2 | T77: =SUM(R[-13]C:R[-1]C) -> 48069 | U77: =AVERAGE(R[-13]C:R[-1]C) -> 8.0546153846153837E-2 | V77: =AVERAGE(R[-13]C:R[-1]C) -> 1.4253846153846157E-2 | W77: =SUM(R[-13]C:R[-1]C) -> 16023 | X77: =AVERAGE(R[-13]C:R[-1]C) -> 7.446923076923076E-2 | Y77: =AVERAGE(R[-13]C:R[-1]C) -> 1.3646153846153846E-2 | Z77: =SUM(R[-13]C:R[-1]C) -> 198371 | AA77: =SUM(R[-13]C:R[-1]C) -> 22821.810000000005 | AB77: =SUM(R[-13]C:R[-1]C) -> 36279 | AC77: =SUM(R[-13]C:R[-1]C) -> 3.55 | AD77: =SUM(R[-13]C:R[-1]C) -> 0 | AE77: =SUM(R[-13]C:R[-1]C) -> 0 | AF77: =SUM(R[-13]C:R[-1]C) -> 7.6 | AG77: =SUM(R[-13]C:R[-1]C) -> 0.19 | AH77: =SUM(R[-13]C:R[-1]C) -> 402.9 | AI77: =SUM(R[-13]C:R[-1]C) -> 3.36 | AJ77: =SUM(R[-13]C:R[-1]C) -> 392 | AK77: =SUM(R[-13]C:R[-1]C) -> 7.3999999999999995
A78: MT | B78: PT0002000081997398TD | C78: PARQUE CENTRAL MAIA | D78: RN22Z805586 | E78: 2022-01-01T00:00:00.000 | F78: 2022-01-31T00:00:00.000 | G78: 31 | H78: 4066.98 | I78: 3304.04 | J78: 24.35 | K78: 165.93 | L78: 232.5 | M78: 116.04 | N78: 2557 | O78: 0.2404 | P78: -7.8729999999999994E-2 | Q78: 7123 | R78: 0.2223 | S78: 1.16E-3 | T78: 3614 | U78: 0.1963 | V78: 1.15E-3 | W78: 1511 | X78: 0.1898 | Y78: 1.14E-3 | Z78: 14805 | AA78: 3007.2 | AB78: 1841 | AC78: 0 | AD78: 0 | AE78: 0 | AF78: 0 | AG78: 0 | AH78: 0 | AI78: 0 | AJ78: 42 | AK78: 0.05
A79: MT | B79: PT0002000081997398TD | C79: PARQUE CENTRAL MAIA | D79: RN22Z812743 | E79: 2022-02-01T00:00:00.000 | F79: 2022-02-28T00:00:00.000 | G79: 28 | H79: 3232.58 | I79: 2625.65 | J79: 22.48 | K79: 138.35 | L79: 232.5 | M79: 104.81 | N79: 2248 | O79: 0.2404 | P79: -7.8729999999999994E-2 | Q79: 5591 | R79: 0.2223 | S79: 1.16E-3 | T79: 2552 | U79: 0.1963 | V79: 1.15E-3 | W79: 1330 | X79: 0.1898 | Y79: 1.14E-3 | Z79: 11721 | AA79: 2370.66 | AB79: 1169 | AC79: 0 | AD79: 0 | AE79: 0 | AF79: 0 | AG79: 0 | AH79: 0 | AI79: 0 | AJ79: 111 | AK79: 0.12
A80: MT | B80: PT0002000081997398TD | C80: PARQUE CENTRAL MAIA | D80: RN22Z816728 | E80: 2022-03-01T00:00:00.000 | F80: 2022-03-31T00:00:00.000 | G80: 31 | H80: 4810.59 | I80: 3908.61 | J80: 33.96 | K80: 231.41 | L80: 232.5 | M80: 116.04 | N80: 3634 | O80: 0.2404 | P80: -7.8729999999999994E-2 | Q80: 8819 | R80: 0.2223 | S80: 1.16E-3 | T80: 3555 | U80: 0.1963 | V80: 1.15E-3 | W80: 1484 | X80: 0.1898 | Y80: 1.14E-3 | Z80: 17492 | AA80: 3543.51 | AB80: 2249 | AC80: 0 | AD80: 0 | AE80: 0 | AF80: 0 | AG80: 0 | AH80: 0 | AI80: 0 | AJ80: 126 | AK80: 0.14000000000000001
A81: MT | B81: PT0002000081997398TD | C81: PARQUE CENTRAL MAIA | D81: RN22Z819124 | E81: 2022-04-01T00:00:00.000 | F81: 2022-04-30T00:00:00.000 | G81: 30 | H81: 3389.8 | I81: 2753.48 | J81: 26.04 | K81: 171.68 | L81: 232.51 | M81: 112.3 | N81: 1484 | O81: 0.2404 | P81: -7.8729999999999994E-2 | Q81: 6213 | R81: 0.2223 | S81: 1.16E-3 | T81: 3243 | U81: 0.1963 | V81: 1.15E-3 | W81: 989 | X81: 0.1898 | Y81: 1.14E-3 | Z81: 11929 | AA81: 2457.46 | AB81: 1089 | AC81: 0 | AD81: 0 | AE81: 0 | AF81: 0 | AG81: 0 | AH81: 0 | AI81: 0 | AJ81: 96 | AK81: 0.11